{
  "artifacts": [
    {
      "authority": "Historical record only",
      "dependencies": [],
      "effective_version": "embedded-or-unversioned",
      "kind": "archive",
      "owner": "VCP-Spec maintainers",
      "path": "archives/README.md",
      "publication_class": "historical",
      "replacement": null,
      "review_date": "2026-08-15",
      "sha256": "bfe3f3925fcadcf03132eddc678db592711ea86e9a4b525e810afb5ed1fc17c3",
      "status": "historical-archived"
    },
    {
      "authority": "Historical record only",
      "dependencies": [],
      "effective_version": "embedded-or-unversioned",
      "kind": "archive",
      "owner": "VCP-Spec maintainers",
      "path": "archives/evidence/2026-03/AUDIT_QUICK_REFERENCE.md",
      "publication_class": "historical",
      "replacement": null,
      "review_date": "2026-08-15",
      "sha256": "334a273ed4a4e2a6580f0e271e7454b62f9c1a293f34275ccccd15c7ae8be8c8",
      "status": "historical-archived"
    },
    {
      "authority": "Historical record only",
      "dependencies": [],
      "effective_version": "embedded-or-unversioned",
      "kind": "archive",
      "owner": "VCP-Spec maintainers",
      "path": "archives/evidence/2026-03/ISSUES_QUICK_REFERENCE.md",
      "publication_class": "historical",
      "replacement": null,
      "review_date": "2026-08-15",
      "sha256": "9c4b4e326c7e360c65e4462c63dd52970a7a16a98c9d5c3efde29419fd11d054",
      "status": "historical-archived"
    },
    {
      "authority": "Historical record only",
      "dependencies": [],
      "effective_version": "embedded-or-unversioned",
      "kind": "archive",
      "owner": "VCP-Spec maintainers",
      "path": "archives/evidence/2026-03/README.md",
      "publication_class": "historical",
      "replacement": null,
      "review_date": "2026-08-15",
      "sha256": "ead045dad1f9af0bc5a7dde2acf2f41bd2edc8ecdbf03bf8fc1a8a2797d46cbf",
      "status": "historical-archived"
    },
    {
      "authority": "Historical record only",
      "dependencies": [],
      "effective_version": "embedded-or-unversioned",
      "kind": "archive",
      "owner": "VCP-Spec maintainers",
      "path": "archives/project-records/README.md",
      "publication_class": "historical",
      "replacement": null,
      "review_date": "2026-08-15",
      "sha256": "163d3622456aab14b31e262a5cb98e74841058b938b9f8a9c8e66fada6fcda85",
      "status": "historical-archived"
    },
    {
      "authority": "Historical record only",
      "dependencies": [],
      "effective_version": "embedded-or-unversioned",
      "kind": "archive",
      "owner": "VCP-Spec maintainers",
      "path": "archives/project-records/VCP_TORCH_ARCHITECTURE.md",
      "publication_class": "historical",
      "replacement": null,
      "review_date": "2026-08-15",
      "sha256": "bb7ad8e00561809b5b2b381e875aa534882db8e2e91c5f9757d8c07da9139c91",
      "status": "historical-archived"
    },
    {
      "authority": "Interim VCP-Spec maintainers; immutable release authority remains open",
      "dependencies": [],
      "effective_version": "embedded-or-unversioned",
      "kind": "machine-readable-artifact",
      "owner": "VCP-Spec maintainers",
      "path": "registries/agent-runtime-terms.json",
      "publication_class": "normative-candidate",
      "replacement": null,
      "review_date": "2026-08-15",
      "sha256": "652436d271f384b9b139822ee14cba1f1c3c73cdbaffa90328b04704b2c6ec4d",
      "status": "active-source-candidate"
    },
    {
      "authority": "Interim VCP-Spec maintainers; immutable release authority remains open",
      "dependencies": [],
      "effective_version": "embedded-or-unversioned",
      "kind": "machine-readable-artifact",
      "owner": "VCP-Spec maintainers",
      "path": "registries/candidate-requirements.json",
      "publication_class": "normative-candidate",
      "replacement": null,
      "review_date": "2026-08-15",
      "sha256": "e61976c8535d38960fadfdef5c53e6bffa89a3da0cdc0882955a187f8d8869a5",
      "status": "active-source-candidate"
    },
    {
      "authority": "Interim VCP-Spec maintainers; immutable release authority remains open",
      "dependencies": [],
      "effective_version": "embedded-or-unversioned",
      "kind": "machine-readable-artifact",
      "owner": "VCP-Spec maintainers",
      "path": "registries/errata.json",
      "publication_class": "normative-candidate",
      "replacement": null,
      "review_date": "2026-08-15",
      "sha256": "a1bb32b6679048b1318eaee915d614e20bafeb8c11babbd9e31e77dfc69db468",
      "status": "active-source-candidate"
    },
    {
      "authority": "Interim VCP-Spec maintainers; immutable release authority remains open",
      "dependencies": [],
      "effective_version": "embedded-or-unversioned",
      "kind": "machine-readable-artifact",
      "owner": "VCP-Spec maintainers",
      "path": "registries/provisional-identifiers.json",
      "publication_class": "normative-candidate",
      "replacement": null,
      "review_date": "2026-08-15",
      "sha256": "23dba1b78ba880ced928f5ea9737ae6c818f228734622b997f065a03d9569281",
      "status": "active-source-candidate"
    },
    {
      "authority": "Interim VCP-Spec maintainers; immutable release authority remains open",
      "dependencies": [],
      "effective_version": "embedded-or-unversioned",
      "kind": "machine-readable-artifact",
      "owner": "VCP-Spec maintainers",
      "path": "registries/verification-status-codes.json",
      "publication_class": "normative-candidate",
      "replacement": null,
      "review_date": "2026-08-15",
      "sha256": "84c75c30c507e4ef19afd12e62ad8e679a8fbf43b169ec4bb08b0efdf6a4a698",
      "status": "active-source-candidate"
    },
    {
      "authority": "Example only; controlling specification and schema take precedence",
      "dependencies": [],
      "effective_version": "embedded-or-unversioned",
      "kind": "example",
      "owner": "VCP-Spec maintainers",
      "path": "schemas/examples/invalid/vcp-adaptation-context.invalid-whitespace.json",
      "publication_class": "illustrative",
      "replacement": null,
      "review_date": "2026-08-15",
      "sha256": "915b51126e81d691f625f9eea3523a15b90a0644af90b0cb111bc827d2934312",
      "status": "illustrative"
    },
    {
      "authority": "Example only; controlling specification and schema take precedence",
      "dependencies": [],
      "effective_version": "embedded-or-unversioned",
      "kind": "example",
      "owner": "VCP-Spec maintainers",
      "path": "schemas/examples/invalid/vcp-capability-handshake.invalid-leading-zero-version.json",
      "publication_class": "illustrative",
      "replacement": null,
      "review_date": "2026-08-15",
      "sha256": "f3ef89369e6c6b36c67fb9add6b111fd72bf21122b6b87e76d1f477fb18ca8bf",
      "status": "illustrative"
    },
    {
      "authority": "Example only; controlling specification and schema take precedence",
      "dependencies": [],
      "effective_version": "embedded-or-unversioned",
      "kind": "example",
      "owner": "VCP-Spec maintainers",
      "path": "schemas/examples/invalid/vcp-capability-handshake.invalid-version-range.json",
      "publication_class": "illustrative",
      "replacement": null,
      "review_date": "2026-08-15",
      "sha256": "d8f0ee6c3bbf85ad6c3b5f50c9289b5ded43f92e76491a0259f0fe50535ac30d",
      "status": "illustrative"
    },
    {
      "authority": "Example only; controlling specification and schema take precedence",
      "dependencies": [],
      "effective_version": "embedded-or-unversioned",
      "kind": "example",
      "owner": "VCP-Spec maintainers",
      "path": "schemas/examples/invalid/vcp-manifest-v1.invalid-composition-layer.json",
      "publication_class": "illustrative",
      "replacement": null,
      "review_date": "2026-08-15",
      "sha256": "b2d8f199b8fee66596571b176b6aa88d71c883fd86dc6932a26d0516d0176217",
      "status": "illustrative"
    },
    {
      "authority": "Example only; controlling specification and schema take precedence",
      "dependencies": [],
      "effective_version": "embedded-or-unversioned",
      "kind": "example",
      "owner": "VCP-Spec maintainers",
      "path": "schemas/examples/invalid/vcp-manifest-v1.invalid-duplicate-signer-id.json",
      "publication_class": "illustrative",
      "replacement": null,
      "review_date": "2026-08-15",
      "sha256": "7b6388cc0ce90a516d95adcd8f52927d15dcc9837864662f62631cb9f981a825",
      "status": "illustrative"
    },
    {
      "authority": "Example only; controlling specification and schema take precedence",
      "dependencies": [],
      "effective_version": "embedded-or-unversioned",
      "kind": "example",
      "owner": "VCP-Spec maintainers",
      "path": "schemas/examples/invalid/vcp-manifest-v1.invalid-multisig-without-signers.json",
      "publication_class": "illustrative",
      "replacement": null,
      "review_date": "2026-08-15",
      "sha256": "85f79a71f27eccb2eba5653ac1192d626c4f8b32f8af5ea348fe21edb678a53a",
      "status": "illustrative"
    },
    {
      "authority": "Example only; controlling specification and schema take precedence",
      "dependencies": [],
      "effective_version": "embedded-or-unversioned",
      "kind": "example",
      "owner": "VCP-Spec maintainers",
      "path": "schemas/examples/invalid/vcp-manifest-v1.invalid-signature-length.json",
      "publication_class": "illustrative",
      "replacement": null,
      "review_date": "2026-08-15",
      "sha256": "d3b7563647444b41ebc451daeed7b63c22a578e257069f61014c327459b6a069",
      "status": "illustrative"
    },
    {
      "authority": "Example only; controlling specification and schema take precedence",
      "dependencies": [],
      "effective_version": "embedded-or-unversioned",
      "kind": "example",
      "owner": "VCP-Spec maintainers",
      "path": "schemas/examples/invalid/vcp-manifest-v1.invalid-threshold-exceeds-signers.json",